{
  "tipo": "questao",
  "fase_alvo": 1,
  "uc_slug": "med_unidavi_f01_uc02_concepcao_formacao_ser_humano",
  "tema": "Embriogênese — período pré-embrionário",
  "subtema": "Implantação e formação do disco bilaminar",
  "sp_referencia": "med_unidavi_f01_uc02_sp03",
  "roteiro_morfofuncional_referencia": "med_unidavi_f01_uc02_morfo04",
  "cenario_origem": ["sessao_tutorial", "conferencia"],
  "competencia_dcn_2025": ["dcn2025_comp_03", "dcn2025_comp_21"],
  "nivel_bloom": "aplicacao",
  "area_clinica": "ginecologia_obstetricia",
  "dificuldade_editorial": "medio",
  "tags": ["embriogenese", "trofoblasto", "primeira_semana"],
  "texto_base": "Mulher de 32 anos, primigesta, na 8ª semana de gestação, comparece à primeira consulta de pré-natal. Refere ciclos menstruais regulares antes da concepção. A ultrassonografia transvaginal demonstra saco gestacional bem implantado em parede uterina posterior, com embrião e batimentos cardíacos presentes. A paciente questiona a médica sobre o processo inicial de fixação do embrião ao útero.",
  "enunciado": "Qual estrutura embrionária é responsável pela invasão da decídua materna e pelo estabelecimento da circulação útero-placentária no início da gestação?",
  "alternativas": [
    {
      "letra": "A",
      "texto": "Sinciciotrofoblasto",
      "correta": true,
      "justificativa": "Correta. O sinciciotrofoblasto é a camada externa do trofoblasto que invade ativamente a decídua materna a partir do 6º-7º dia pós-fecundação, estabelecendo as lacunas trofoblásticas que darão origem à circulação útero-placentária primitiva."
    },
    {
      "letra": "B",
      "texto": "Mesoderma intraembrionário",
      "correta": false,
      "justificativa": "Incorreta. O mesoderma intraembrionário forma-se durante a gastrulação (3ª semana), após a implantação já estar consolidada. Não tem papel direto na invasão da decídua."
    },
    {
      "letra": "C",
      "texto": "Endoderma extraembrionário",
      "correta": false,
      "justificativa": "Incorreta. O endoderma extraembrionário (hipoblasto) origina o saco vitelino primitivo e tem função nutricional inicial, mas não invade tecido materno."
    },
    {
      "letra": "D",
      "texto": "Notocorda",
      "correta": false,
      "justificativa": "Incorreta. A notocorda forma-se na 3ª semana, durante a gastrulação, e atua como indutor do tubo neural — sem relação com implantação."
    }
  ],
  "imagens_anexadas": [
    {
      "id_imagem": "med_unidavi_img_00042",
      "posicao": "enunciado",
      "ordem": 1,
      "tipo": "esquema",
      "legenda": "Disco embrionário bilaminar e cavidade amniótica primitiva — segunda semana de desenvolvimento",
      "alt_text": "Esquema didático do disco bilaminar embrionário, mostrando as camadas de epiblasto e hipoblasto, a cavidade amniótica em formação e a delimitação do trofoblasto periférico em sinciciotrofoblasto e citotrofoblasto.",
      "creditos_imagem": "Adaptado de Moore & Persaud, Embriologia Clínica, 11ª ed. — uso institucional"
    }
  ],
  "referencia": "MOORE, K.L.; PERSAUD, T.V.N. Embriologia clínica. 11ª ed. Rio de Janeiro: GEN Guanabara Koogan, 2020. Cap. 3.",
  "fonte_geracao": "capi-questoes-enamed v1.3 (exemplo de calibração)",
  "status_curadoria": "pendente",
  "disponibilidade": "disponivel",
  "meses_desde_ultimo_uso": null,
  "versao": 1,
  "uso_em_avaliacoes": {"total_avaliativo": 0, "ultima_avaliacao_em": null, "historico": []},
  "performance": {"n_respostas_treino": 0, "n_respostas_avaliativo": 0, "taxa_acerto_treino": null, "taxa_acerto_avaliativo": null, "dificuldade_tri_b": null, "discriminacao_tri_a": null},
  "auditoria": {"criada_por": "capi-questoes-enamed v1.3", "criada_em": "2026-07-04T00:00:00Z", "curada_por": null, "curada_em": null, "edicoes": []}
}
